Title,Year,
Language maintenance?  Patterns of language use in immigrant families,2015,
Languages Across Borders Social Network Development in an Adolescent TwoWay Language Program,2015,
Latour goes to kindergarten Children marshaling allies in a spontaneous argument about what counts as science,2015,
Leading school networks Hybrid leadership in action?,2015,
Learning and Instruction Research in the AsiaPacific Region from 2002 to 2011 Examining Trends Authors and Institutions,2015,
Learning connected civics Narratives practices infrastructures,2015,
Learning in and beyond school gardens with cyberphysical systems,2015,
Learning in the Cafe Pilot testing the collaborative application for education in Facebook,2015,
Learning to Be. A Perspective from British Columbia Canada,2015,
Leveraging the relationship knowledge processes in schooluniversity research networks of master's programmes,2015,
Linking Learning Styles and Learning on Mobile Facebook,2015,
Literacy and Language Teaching and Learning With Interactive Whiteboards in Early Schooling,2015,
Magnets and Seekers A Network Perspective on Academic Integration inside Two Residential Communities,2015,
Malaria and the Decline of Ancient Greece Revisiting the Jones Hypothesis in an Era of Interdisciplinarity,2015,
Management challenges in an information communication technology (ICT) network in rural schools,2015,
Mandarin Chinese in London education language aspirations in a workingclass secondary school,2015,
MAPPING CONCEPTUAL UNDERSTANDING OF ALGEBRAIC CONCEPTS AN EXPLORATORY INVESTIGATION INVOLVING GRADE 8 CHINESE STUDENTS,2015,
Mapping Global Research on International Higher Education,2015,
Mapping learning and game mechanics for serious games analysis,2015,
Massively Open Online Course for Educators (MOOCEd) network dataset,2015,
Measuring Knowledge Elaboration Based on a ComputerAssisted Knowledge Map Analytical Approach to Collaborative Learning,2015,
Measuring social capital among youth applications in environmental education,2015,
Medical education departments a study of four medical schools in SubSaharan Africa,2015,
Mendel's Research Legacy in the Broader Historical Network,2015,
Men's health  a little in the shadow a formative evaluation of medical curriculum enhancement with men's health teaching and learning,2015,
MEN'S VOLLEYBALL ARE FOR MEN REPRESENTATIONS OF THE HOMOSEXUAL AND THE SUPPORTER ON AN EPISODE OF HOMOPHOBIA,2015,
MESH Pakistan prospects and challenges,2015,
Mobilising Mother Cabrini's educational practice the transnational context of the London school of the Missionary Sisters of the Sacred Heart of Jesus 18981911,2015,
Motivating study groups across the disciplines in secondary schools,2015,
Moving across physical and online spaces a case study in a blended primary classroom,2015,
Multidisciplinary Approach to Designing Space of Early Childhood Education Institutions as a Condition for HighQuality Education Process,2015,
Negotiating managerialism professional recognition and teachers of sustainable development education,2015,
Negotiating managerialism professional recognition and teachers of sustainable development education,2015,
Network Statistical Models for Language Learning Contexts Exponential Random Graph Models and Willingness to Communicate,2015,
Networking and the development of professionals Beginning teachers building social capital,2015,
Networks in New York City Implementing the Common Core,2015,
New Elders Old Divides ICTs Inequalities and WellBeing amongst Young Elderly Italians,2015,
Not just 'sunny days' Aboriginal students connect outofschool literacy resources with school literacy practices,2015,
Occupational Control in Education The Logic and Leverage of Epistemic Communities,2015,
ONCE A NAVEGANTE ALWAYS A NAVEGANTE LATINO MEN SUSTAIN THEIR ROLES AS LAY HEALTH ADVISORS TO PROMOTE GENERAL AND SEXUAL HEALTH TO THEIR SOCIAL NETWORK,2015,
One Size Does Not Fit All Differentiating Leadership to Support Teachers in School Reform,2015,
Online Peer Evaluation for Assessing Perceived Academic Engagement in Higher Education,2015,
Online system adoption and K12 academic outcomes,2015,
Open Informational Ecosystems The Missing Link for Sharing Educational Resources,2015,
Open to influence what counts as academic influence in scholarly networked Twitter participation,2015,
Openness technologies business models and austerity,2015,
Opportunities and challenges for building alumni networks in Sweden a case study of Stockholm University,2015,
Opportunities and Outcomes The Role of Peers in Developing the Oral Academic English Proficiency of Adolescent English Learners,2015,
Outcomes of a SelfRegulated Learning Curriculum Model Network Analysis of Middle School Students' Views of Nature of Science,2015,
Parents' Conceptions of School Readiness Transition Practices and Children's Academic Achievement Trajectories,2015,
Participation interaction and academic achievement in an online discussion environment,2015,
Participatory Democracy and Struggling Schools Making Space for Youth in School Turnarounds,2015,
Participatory knowledge mobilisation an emerging model for international translational research in education,2015,
Patterns of discursive interactions in primary classrooms an application of social network analysis,2015,
PedagogicallyDriven Ontology Network for Conceptualizing the eLearning Assessment Domain,2015,
Peer interaction and social network analysis of online communities with the support of awareness of different contexts,2015,
Peer turnover and student achievement Implications for classroom assignment policy,2015,
Performativity and pedagogising knowledge globalising educational policy formation dissemination and enactment,2015,
Performing a ChoiceNarrative A qualitative study of the patterns in STEM students' higher education choices,2015,
Personal Learning Network Clusters A Comparison Between Mathematics and Computer Science Students,2015,
Pervasive Knowledge Social Networks and Cloud Computing ELearning 2.0,2015,
Pervy roleplay and such' girls' experiences of sexual messaging online,2015,
Postdoctoral positions as preparation for desired careers a narrative approach to understanding postdoctoral experience,2015,
Predicting Preservice Classroom Teachers' Civil Servant Recruitment Examination's Educational Sciences Test Scores Using Artificial Neural Networks,2015,
Preparing atrisk youth for a changing world revisiting a personincontext model for transition to employment,2015,
Preschool teachers' informal online professional development in relation to educational use of tablets in Swedish preschools,2015,
Privatizing Education Free School Policy in Sweden and England,2015,
Problematic Internet Use and Its Correlates Among Students from Three Medical Schools Across Three Countries,2015,
Problems Without Ceilings How Mentors and Novices Frame and Work on ProblemsofPractice,2015,
Production and consumption of university Linked Data,2015,
Professional Learning Communities and the Diffusion of Pedagogical Innovation in the Chinese Education System,2015,
Promoting collaborative writing through wikis a new approach for advancing innovative and active learning in an ESP context,2015,
Promoting instructional change using social network analysis to understand the informal structure of academic departments,2015,
Promoting research and audit at medical school evaluating the educational impact of participation in a studentled national collaborative study,2015,
Quality assurance of quality assurance agencies from an Asian perspective regulation autonomy and accountability,2015,
Quality in Family Child Care A Focus Group Study with Canadian Providers,2015,
Questions from afar the influence of outsideness on webbased conversation,2015,
Questions of Matter Critical Conversations in Online Spaces,2015,
R&D Welcoming immigrant students with a highquality education,2015,
Really on the ball' exploring the implications of teachers' PECPD experience,2015,
Rebuilding higher education institutions in postconflict contexts Policy networks process perceptions & patterns,2015,
Recalibrating baseline evidence in Burundi Malawi Senegal and Uganda exploring the potential of multisite nationallevel stakeholder engagement in participatory evaluation,2015,
Reflexivity and the politics of knowledge researchers as 'brokers' and 'translators' of educational development,2015,
Regimes of performance practices of the normalised self in the neoliberal university,2015,
Relational ways of being an educator traumainformed practice supporting disenfranchised young people,2015,
Repertoire networks among national boardcertified physical education teachers,2015,
Research on academic writing in the teachinglearning processes in the Spanish university context,2015,
Research on SNS and education The state of the art and its challenges,2015,
Rethinking ICT literacy From computer skills to social network settings,2015,
Reviewing the differences in size composition and structure between the personal networks of high and lowperforming students,2015,
Roles of Course Facilitators Learners and Technology in the Flow of Information of a CMOOC,2015,
Schoolbased social capital The missing link between schools' socioeconomic composition and collective teacher efficacy,2015,
Schooling choice in South Africa The limits of qualifications and the politics of race class and symbolic power,2015,
Science and religion on the blackboard exploring schoolmasters' beliefs and practices in Senegal,2015,
See Translation explicit and implicit language policies on Facebook,2015,
SEEKING CONNECTIVIST FREEDOM AND INSTRUCTIVIST SAFETY IN A MOOC,2015,
Selfemergent peer support using online social networking during crossborder transition,2015,
Sense of community in academic communities of practice predictors and effects,2015,
Short Cuts and Extended Techniques Rethinking relations between technology and educational theory,2015,
Similar Students Different Choices Who Uses a School Voucher in an Otherwise Similar Population of Students?,2015,
SOCIAL CAPITAL ON FACEBOOK AS PERCEIVED BY LITHUANIAN UNIVERSITY STUDENTS A MULTIDIMENSIONAL PERSPECTIVE,2015,
Social Capital for College Network Composition and Access to Selective Institutions Among Urban High School Students,2015,
Social capital from online discussion forums Differences between online and blended modes of delivery,2015,
Social capital in metropolitan playgroups A qualitative analysis of early parental interactions,2015,
Social capital in the classroom a study of inclass social capital and school adjustment,2015,
Social Networking Phenomenon and its Use in Libraries,2015,
Standardsbased governance of English teaching past present and future?,2015,
Stop talking and type comparing virtual and facetoface mentoring in an epistemic game,2015,
STRENGTHENING TEACHING PRACTICES AT UNIVERSITIES IN COLOMBIA THROUGH ICT. CASE OF THE CARIBBEAN REGION,2015,
'Student engagement' and the tyranny of participation,2015,
Student engagement in coursebased social networks The impact of instructor credibility and use of communication,2015,
Students' Playful Tactics TEACHING AT THE INTERSECTION OF NEW MEDIA AND THE OFFICIAL CURRICULUM,2015,
Studies in Higher Education 19762013 a retrospective using citation network analysis,2015,
STUDY ABOUT THE EFFECTS OF HYPERTEXT IN READING COMPREHENSION AND TEXTUAL MEMORY IN CHILDREN OF PRIMARY EDUCATION,2015,
STUDY OF THE INFLUENCE OF SOCIAL RELATIONSHIPS AMONG STUDENTS ON KNOWLEDGE BUILDING USING A MODERATELY CONSTRUCTIVIST LEARNING MODEL,2015,
Surfing USA How Internet Use Prior to and During Study Abroad Affects Chinese Students' Stress Integration and Cultural Learning While in the United States,2015,
Task design and its induced learning effects in a crossinstitutional blogmediated telecollaboration,2015,
Teacher Education's Challenge of Changing Research Relationships With Schools,2015,
Teacher mobility and transnational 'British World' space the League of the Empire's 'Interchange of Home and Dominion Teachers' 19071931,2015,
Teacher professionalization in the age of social networking sites,2015,
Teacher unions' participation in policy making a South African case study,2015,
TEACHING CRITICAL ETHICAL AND SAFE USE OF ICT IN PRESERVICE TEACHER EDUCATION,2015,
Teaching Cybersecurity Using the Cloud,2015,
Teaching health sciences students about culturally sensitive communication between health professionals and patients from diverse cultures,2015,
Teaching Sisters and transnational networks recruitment and education expansion in the long nineteenth century,2015,
Teaching without faculty policy interactions and their effects on the network of teaching in German higher education,2015,
Technological utopia dystopia and ambivalence Teaching with social media at a South African university,2015,
Telecommunication Industry Contributions to Child Online Protection,2015,
The building blocks of digital media literacy sociomaterial participation and the production of media knowledge,2015,
The changing functions of citation from knowledge networking to academic cashvalue,2015,
The changing role of students' unions within contemporary higher education,2015,
The Contribution of East Asian Countries to Internationally Published Asian Higher Education Research The Role of System Development and Internationalization,2015,
The current status of teaching staff innovation competence in Ugandan universities perceptions of managers teachers and students,2015,
The Development of Capacity for Data Use The Role of Teacher Networks in an Elementary School,2015,
The Dialogic Interplay of Writing and Teaching Writing TeacherWriters' Talk and Textual Practices across Contexts,2015,
The dynamic duo of professional learning = collaboration and technology,2015,
The effect of centralization and cohesion on the social construction of knowledge in discussion forums,2015,
The enactment of professional learning policies performativity and multiple ontologies,2015,
The evolutionary map of the seasons,2015,
The Homestay in Intensive Language Study Abroad Social Networks Language Socialization and Developing Intercultural Competence,2015,
The hybrid shift Evidencing a studentdriven restructuring of the college classroom,2015,
The Ignorant Supervisor About common worlds epistemological modesty and distributed knowledge,2015,
The Impact of Media on Students' Perception of the Security Risks Associated With Internet Social Networking  A Case Study,2015,
The impact of technologyenhanced curriculum on learning advanced algebra in US high school classrooms,2015,
The impacts of network centrality and selfregulation on an elearning environment with the support of social network awareness,2015,
The implications of Autonomist Marxism for research and practice in education and technology,2015,
The increasingly long road to school in rural China the impacts of education network consolidation on broadly defined schooling distance in Xinfeng County of rural China,2015,
The influence of informal learning processes of social network sites on the subjective wellbeing of women in rural areas,2015,
The Nature of Selected English Teachers' Online Participation,2015,
The Norden Associations and international efforts to change history education 19191970 international organisations education and hegemonic nationalism,2015,
The open dataset on students' perceptions of virtual learning environments in Ireland Collaborating to listen to the student voice,2015,
The Potential of a Mobile Group Blog to Support Cultural Learning Among Overseas Students,2015,
THE PRACTICES AND CHALLENGES OF TELECOLLABORATION IN HIGHER EDUCATION IN EUROPE,2015,
The promise reality and dilemmas of secondary school teacherstudent interactions in Facebook The teacher perspective,2015,
The role of music in the education of young male workers in nineteenthcentury Greece the case of charity institutions,2015,
The Role of Social Media for Collaborative Learning to Improve Academic Performance of Students and Researchers in Malaysian Higher Education,2015,
The role of social origin and field of study on graduates' overeducation the case of Italy,2015,
The role of transnational networking for higher education academics,2015,
The social context of parenting mothers' inner resources and social structures,2015,
The sociomateriality of education policy,2015,
The wear out effect of a gamebased student response system,2015,
Theories and Applications of Massive Online Open Courses (MOOCs) The Case for Hybrid Design,2015,
Theorizing Teacher Agency and Reform How Institutionalized Instructional Practices Change and Persist,2015,
Toward a Descriptive Science of Teaching How the TDOP Illuminates the Multidimensional Nature of Active Learning in Postsecondary Classrooms,2015,
Towards a Social Networks Model for Online Learning & Performance,2015,
Towards a theory of transnational academic capitalism,2015,
Transnational connections competences and identities experiences of Chinese international students after their return 'home',2015,
Trends in Distance Education Research A Content Analysis of Journals 20092013,2015,
Trusting Each Other StudentCounselor Relationships in Diverse High Schools,2015,
Uncovering changes in university teachers' professional networks during an instructional development program,2015,
Uncovering the images and meanings of international organizations (IOs) in higher education research,2015,
Underrepresentation of EthiopianIsraeli minority students in programmes for the gifted and talented a policy discourse analysis,2015,
Understanding Older Adults' Perceptions of Internet Use An Exploratory Factor Analysis,2015,
Understanding residents' environmental knowledge in a metropolitan city of Hong Kong China,2015,
Understanding students' perceptions of the benefits of online social networking use for teaching and learning,2015,
Understanding undergraduate sports coaching students' development and learning the necessity of uncertainty,2015,
Uses and Gratifications of Computers in South African Elderly People,2015,
Using Facebook to Supplement Participant Pools for Class Research Projects Should We Like It?,2015,
Using Improvement Science to Better Support Beginning Teachers The Case of the Building a Teaching Effectiveness Network,2015,
Using iPads as a learning tool in crosscurricular collaborative initial teacher education,2015,
Using Social Networking Sites for Teaching and Learning Students' Involvement in and Acceptance of Facebook (R) as a Course Management System,2015,
Validity of a Residualized Dependent Variable After Pretest Covariance Adjustments Still the Same Variable?,2015,
Validity of Social Moral and Emotional Facets of SelfDescription Questionnaire II,2015,
Value creation in online communities for educators,2015,
Videomaking as sociomaterial assemblage,2015,
Visual Representations on High School Biology Chemistry Earth Science and Physics Assessments,2015,
What comes out of incentivized collaboration A qualitative analysis of eight Flemish school networks,2015,
What's on YOUR Facebook profile? Evaluation of an educational intervention to promote appropriate use of privacy settings by medical students on social networking sites,2015,
When things come undone the promise of dissembling education policy,2015,
Who Studies MOOCs? Interdisciplinarity in MOOC Research and its Changes over Time,2015,
Why So Difficult? Exploring Negative Relationships between Educational Leaders The Role of Trust Climate and Efficacy,2015,
Why start a higher degree by research? An exploratory factor analysis of motivations to undertake doctoral studies,2015,
WIKIPEDIA WRITING AS PRAXIS COMPUTERMEDIATED SOCIALIZATION OF SECONDLANGUAGE WRITERS,2015,
Words on the screen broadening analyses of interactions among fanfiction writers and reviewers,2015,
Workbased researchers and Communities of Practice Conceptual and gestational dilemmas,2015,
You cannot talk with all of the strangers in a pub' a longitudinal case study of international postgraduate students' social ties at a British university,2015,
(Un)Commonly Connected A Social Network Analysis of State Standards Resources for English/Language Arts,2016,
A case study on the formation and sharing process of science classroom norms,2016,
A CoCitation Network of Young Children's Learning with Technology,2016,
A comparative study of Facebook vs. paperandpencil writing to improve L2 writing skills,2016,
A Computational Model of Learners Achievement Emotions Using ControlValue Theory,2016,
A computer approach to mathematics curriculum developments debugging,2016,
A crossnational study of direct and indirect effects of cyberbullying on cybergrooming victimization via selfesteem,2016,
A CURRENT MODE OF GENDER VIOLENCE IN COUPLES OF YOUNG PEOPLE SOCIAL NETWORKS,2016,
A Debate and DecisionMaking Tool for Enhanced Learning,2016,
A Decision Tool for Selecting a Sustainable Learning Technology Intervention,2016,
A Latin American Portuguese and Spanish consensus on a core communication curriculum for undergraduate medical education,2016,
A methodological framework to analyze stakeholder preferences and propose strategic pathways for a sustainable university,2016,
A mixed methods approach to the assessor's targeting behavior during online peer assessment effects of anonymity and underlying reasons,2016,
A research analytics frameworksupported recommendation approach for supervisor selection,2016,
A Social Learning Management System Supporting Feedback for Incorrect Answers based on Social Network Services,2016,
A social network analysis of teaching and research collaboration in a teachers' virtual learning community,2016,
A solutionbased intelligent tutoring system integrated with an online gamebased formative assessment development and evaluation,2016,
Academic and research networks management challenges for higher education institutions in Mexico,2016,
Academic entrepreneurship and traditional academic duties synergy or rivalry?,2016,
Advancing the One Health' workforce by integrating ecosystem health practice into veterinary medical education The Envirovet Summer Institute,2016,
AfterSchool Spaces Looking for Learning in All the Right Places,2016,
Age of acquisition and imageability a crosstask comparison,2016,
An Analysis of Density and DegreeCentrality According to the Social Networking Structure Formed in an Online Learning Environment,2016,
An Approach Based on Social Network Analysis Applied to a Collaborative Learning Experience,2016,
An assessment of online instructor elearning readiness before during and after course delivery,2016,
AN EXPERIENCE IN UNIVERSITYENTERPRISE RELATIONS THE COGEMPLEO PROJECT IN THE TECHNOLOGICAL FOUNDATION CAMPUS OF ALGECIRAS,2016,
Analysing the correlation between social network analysis measures and performance of students in social networkbased engineering education,2016,
Analyzing educators' online interactions a framework of online learning support roles,2016,
Applied PhD research in a workbased environment an activity theorybased analysis,2016,
Applying an online gamebased formative assessment in a flowchartbased intelligent tutoring system for improving problemsolving skills,2016,
ASSESSING COLLECTIVISM IN LATINO ASIAN/PACIFIC ISLANDER AND AFRICAN AMERICAN MEN WHO HAVE SEX WITH MEN A PSYCHOMETRIC EVALUATION,2016,
Associational social capital and psychological type an empirical enquiry among cathedral Friends in England,2016,
Attitude towards working in rural area and selfassessment of competencies in last year medical students A survey of five countries in Asia,2016,
Audience in the service of learning how kids negotiate attention in an online community of interactive media designers,2016,
Barriers to women leaders in academia tales from science and technology,2016,
Between Structure and Agency Contextualizing School Leaders' Strategic Responses to Market Pressures,2016,
Beyond performance metrics Examining a decrease in students' physics selfefficacy through a social networks lens,2016,
Blending Formal and Informal Learning Networks for Online Learning,2016,
Blogs as a learning and assessment instrument for Englishspeaking performance,2016,
Broadening Educational Outcomes Social Relations Skills Development and Employability for Youth,2016,
Capacity building and communitas in the history of education,2016,
Career Development Institute with Enhanced Mentoring A Revisit,2016,
Career satisfaction of postdoctoral researchers in relation to their expectations for the future,2016,
Cascades torrents & drowning in information seeking help in the contemporary general practitioner practice in the UK,2016,
Challenging the notion of the transition year The experiences of rural and urban tertiary students,2016,
Cheating or cheated? Surviving secondary exit exams in a neoliberal era,2016,
Closing an Opportunity Gap How a Modest Program Made a Difference,2016,
Cloud elearning service strategies for improving elearning innovation performance in a fuzzy environment by using a new hybrid fuzzy multiple attribute decisionmaking model,2016,
Collaboration in ePortfolios with Web 2.0 tools in initial teacher training,2016,
Collaborative Networks to Provide Media Accessibility the Potential of Social Subtitling,2016,
College student mental health and quality of workplace relationships,2016,
Coming Full Circle With Reactions Understanding the Structure and Correlates of Trainee Reactions Through the Affect Circumplex,2016,
Commercialising comparison Pearson puts the TLC in soft capitalism,2016,
Communicating in 140 Characters. How Journalists in Spain use Twitter,2016,
Community Media as an Exercise of Communicative Citizenship Experiences from Argentina and Ecuador,2016,
