Title,Year,
Five Decades of Mathematics Education Research,2018,
Fostering student engagement in online discussion through social learning analytics,2018,
Friends academic achievement and school engagement during adolescence A social network approach to peer influence and selection effects,2018,
From Designing to Organizing New Social Futures Multiliteracies Pedagogies for Today,2018,
From objects to subjects Repositioning teachers as policy actors doing policy work,2018,
From resource to document scaffolding content and organising student learning in teachers' documentation work on the teaching of series,2018,
From sMOOC to tMOOC learning towards professional transference ECO European Project,2018,
From Tinkering to Going Rogue How Principals Use Agency When Enacting New Teacher Evaluation Systems,2018,
From voting to engaging promoting democratic values across an international school network,2018,
Gender Markets and Inequality A Framework,2018,
Geographical Network Analysis and Spatial Econometrics as Tools to Enhance Our Understanding of Student Migration Patterns and Benefits in the US Higher Education Network,2018,
Hable Bien M'ijo o Gringo o Mx!' language ideologies in the digital communication practices of transnational Mexican bilinguals,2018,
Higher education bridging capital and developmental leadership in the Philippines Learning to be a crossover reformer,2018,
Holistic School Leadership Development of Systems Thinking in School Leaders,2018,
How do Italian vocational teachers educate for a sense of initiative and entrepreneurship? Development and initial application of the SIE questionnaire,2018,
How do students conceptualise a real world learning environment An empirical study of a financial trading room?,2018,
How does innovative continuous professional development (CPD) operate in the ECEC sector? Insights from a crossanalysis of cases in Denmark Italy and Poland,2018,
How Learners Participate in Connectivist Learning An Analysis of the Interaction Traces From a cMOOC,2018,
How PETE comes to matter in the performance of social justice education,2018,
How the study of online collaborative learning can guide teachers and predict students' performance in a medical course,2018,
How to Be a Deaf Scientist Building Navigational Capital,2018,
How to measure students' innovation competences in higher education Evaluation of an assessment tool in authentic learning environments,2018,
Humanism modernism and designing education exploring progressive relations between Australia New Zealand and the West Riding of Yorkshire 1930s1970s,2018,
I Get to Give Back to the Community That Put Me Where I Am Examining the Experiences and Perspectives of Puerto Rican Teachers in Western New York,2018,
Identifying and investigating the best schools a networkbased analysis,2018,
Identifying the characteristics of support Australian university teachers use in their design work Implications for the learning design field,2018,
Immersive technologies and language learning,2018,
Impact of support from social network on entrepreneurial intention of fresh business graduates A structural equation modelling approach,2018,
Improving interaction in teacher training programmes the rise of the social dimension in preservice teacher education,2018,
Incremental impact of time on students' use of Elearning via Facebook,2018,
Influence of Learning Design of the Formation of Online Communities of Learning,2018,
Informal learning of women small business owners,2018,
Informing learning design through analytics Applying network graph analysis,2018,
Infrastructuring Distributed Studio Networks A Case Study and Design Principles,2018,
Innovative Methods for Ideological and Political Education of College Students,2018,
Inside a selfimproving school system Collaboration competition and transition,2018,
Inspiring the next generation of academic physicians the academic health careers program,2018,
Integrating Implementation Science and EvidenceBased Practice Into Academic and Field Curricula,2018,
Integrating Northern Ireland Crossgroup friendships in integrated and mixed schools,2018,
Interactions in MOOCs The Hidden Part of the Iceberg,2018,
Interactive methods of teaching at Russian engineering universities,2018,
Interdisciplinary team education promotes innovations in the home care of older people,2018,
Interests ideas and legacies of the past Analysing the positions and strategies of Swedish policy actors in the establishment of the European Research Council,2018,
International Faculty Contribution to Local Research Capacity Building A View from Publication Data,2018,
International student flows for university education and the bilateral market integration of Australia,2018,
International Students' Perceptions of Their Needs When Going Abroad Services on Demand,2018,
Interprofessional Simulation Training to Promote Working With Families and Networks in Mental Health Services,2018,
Investigating the existence of social networks in cheating behaviors in medical students,2018,
Is facebook involvement associated with academic engagement among Filipino university students? A crosssectional study,2018,
ISeeYou' A womancentred care education and research project in Dutch bachelor midwifery education,2018,
IT'S ALMOST LIKE A CRABINABARREL SITUATION STIGMA SOCIAL SUPPORT AND ENGAGEMENT IN CARE AMONG BLACK MEN LIVING WITH HIV,2018,
Jumping from one resource to another how do students navigate learning networks?,2018,
Just plain peers across social networks Peerfeedback networks nested in personal and academic networks in higher education,2018,
Knowledge Sharing SelfEfficacy Motivation and Sense of Community as Predictors of Knowledge Receiving and Giving Behaviors,2018,
Language play in a second language Social media as contexts for emerging Sociopragmatic competence,2018,
Leadership for Democracy in Challenging Times Historical Case Studies in the United States and Canada,2018,
Leadership for team learning the case of university teacher teams,2018,
Leading 'excellence in infant work' in 1920s Australia,2018,
Leading today's kindergartens Practices of strategic leadership in Hong Kong's early childhood education,2018,
Leading today's kindergartens Practices of strategic leadership in Hong Kong's early childhood education,2018,
Learning across the lifespan Lifelong learning in Neighbourhood Houses in Australia,2018,
Learning Analytics for Supporting Seamless Language Learning using Ebook with Ubiquitous Learning System,2018,
Learning and engagement in a gamified course Investigating the effects of student characteristics,2018,
Learning communities in the crowd Characteristics of content related interactions and social relationships in MOOC discussion forums,2018,
Learning design for multiple modes of provision the Zambian community school teacher development programme,2018,
Learning from and Reacting to School Inspection  Two Swedish Case Narratives,2018,
Learning Stories as crossnational policy borrowing The interplay of globalization and localization in preprimary education in Contemporary China,2018,
Learning With Sound Recordings A History of Suzuki's Mediated Pedagogy,2018,
LEISURE SOCIAL NETWORKS AND SPANISH STUDENTS,2018,
Lessons for coinnovation in agricultural innovation systems a multiple case study analysis and a conceptual model,2018,
Life' and education policy intervention augmentation and computation,2018,
Local adaptation during implementation A case study of the Fussy Baby Network (R) New Orleans and Gulf Coast initiative,2018,
Local Autism Policy Networks Expertise and Intermediary Organizations,2018,
Longer Fixation Times During Reading Are Correlated With Decreased Connectivity in CognitiveControl Brain Regions During Rest in Children,2018,
Lost in translation Understanding Students' use of social networking and online resources to support early clinical practices. A National Survey of graduate speechlanguage pathology students,2018,
Making the most of multidisciplinary undergraduate research conferences,2018,
Mapping changes in support a longitudinal analysis of networks of preservice mathematics and science teachers,2018,
Mapping Inequalities in Local Political Representation Evidence from Ohio School Boards,2018,
Materializing 'Competence' Perspectives From International STEM Scholars,2018,
Measuring digital literacies Junior highschool students' perceived competencies versus actual performance,2018,
Measuring the extent and nature of use of Social Networking Sites in Medical Education (SNSME) by university students Results of a multicenter study,2018,
Measuring the impact of a community of practice in Aboriginal health,2018,
Meat processing company staff as innovation intermediaries developing a framework from New Zealand's red meat sector,2018,
Mechanisms of interactive specialization and emergence of functional brain circuits supporting cognitive development in children,2018,
Mentoring among Latina/o Scholars Enacting Spiritual Activism to Navigate Academia,2018,
Mentorship experiences during registrar training reflections of Black African specialists in the Western Cape,2018,
Mining social media divides an analysis of K12 US School uses of Twitter,2018,
Mobilising knowledge through global partnerships to support researchinformed teaching five models for translational research,2018,
Modeling a learning organization using a molecular network framework,2018,
Multiplicities in Motion A Turn to Transliteracies,2018,
Multistakeholder process strengthens agricultural innovations and sustainable livelihoods of farmers in Southern Nigeria,2018,
Multivariate characterization of university students using the ICT for learning,2018,
Near RealTime Comprehension Classification with Artificial Neural Networks Decoding eLearner NonVerbal Behavior,2018,
Nearby College Enrollment and Geographical Skills Mismatch (Re)conceptualizing Student OutMigration in the American Higher Education System,2018,
Neglected Issues How Charter Schools Manage Teachers and Acquire Resources,2018,
Neighborhood context and centerbased child care use Does immigrant status matter?,2018,
Neoliberal global assemblages The emergence of public international highschool curriculum programs in China,2018,
Network Visual Exploration for the Cooperation Map of Courses in Different Major Curricula,2018,
Networked learning with professionals boosts students' selfefficacy for social networking and professional development,2018,
Networks identify productive forum discussions,2018,
Neural network approach to predict mobile learning acceptance,2018,
New modes of policy legitimation in education (Mis)using comparative data to effectuate assessment reform,2018,
Of course I ask the best students to demonstrate' digital normalizing practices in physical education,2018,
Old Wine in old Bottles the Neglected Role of Vocational Training Centres in Innovation,2018,
On the relationship between society and higher education what path should we take?,2018,
Online communities of teachers to support situational knowledge A designbased study,2018,
Online informal language learning Insights from a Korean learning community,2018,
Opening up design studio education using blended and networked formats,2018,
Parental Challenges to Organizational Authority in an Elite School District The Role of Cultural Social and Symbolic Capital,2018,
Parental socioeconomic status and childcare quality Early inequalities in educational opportunity?,2018,
Participatory learning culture and community formation in connectivist MOOCs,2018,
Participatory methodologies to promote student engagement in the development of educational digital games,2018,
Partnership between a central agency and its schools Towards fostering laterality,2018,
Patterns in the form of formative feedback and student response,2018,
Pedagogical Formation Program Students' Perceptions of Social Network Concept,2018,
Peer social media and alcohol marketing influences on college student drinking,2018,
PERCEPTIONS OF HIV SELFTESTING AMONG MEN WHO HAVE SEX WITH MEN IN THE UNITED STATES A QUALITATIVE ANALYSIS,2018,
Perceptions of secondary school principals on management of cultural diversity in Spain. The challenge of educational leadership,2018,
Personal values social capital and higher education student career decidedness a new protean'informed model,2018,
Personalising and localising knowledge how teachers reconstruct resources and knowledge shared online in their teaching practice,2018,
Policy Makers' Regulatory Mindset the Regulatory Governance Body of the System and the Regulated Soul of Educators,2018,
Pondering purposes propelling forwards,2018,
Practice and performance changing perspectives of teachers through collaborative enquiry,2018,
Practice intentions at entry to and exit from medical schools aspiring to social accountability findings from the Training for Health Equity Network Graduate Outcome Study,2018,
Practising the public? Collaborative teacher inquiry in an era of standardization and accountability,2018,
Predicting Engineering Student Attrition Risk Using a Probabilistic Neural Network and Comparing Results with a Backpropagation Neural Network and Logistic Regression,2018,
Preservice EFL teachers' online participation interaction and social presence,2018,
Prevention of sexual Abuse in Day Care Centers Using the Prevention Project ReSi  Resilience and Safety as an Example,2018,
Primary school teacher experiences in crossphase professional development collaborations,2018,
Principals' moral purpose in the context of LGBT inclusion,2018,
Professional development of kindergarten teachers in Croatia  a personal choice or an obligation,2018,
Profiles of Parenting for LowIncome Families and Links to Children's Preschool Outcomes,2018,
Profiling the digital readiness of higher education students for transformative online learning in the postsoviet nations of Georgia and Ukraine,2018,
Projectbased community participatory action research using geographic information technologies,2018,
Promotion of child development and health from the perinatal period an approach from positive parenting,2018,
Psychosocial issues discovered through reflective group dialogue between medical students,2018,
Quality Evaluation Method of College Graduates' Innovation and Entrepreneurship Education Based on the Principle of Brain Neurology,2018,
Reallife closeness of social media contacts and depressive symptoms among university students,2018,
Reallife closeness of social media contacts and depressive symptoms among university students,2018,
Recruiting Talent School Choice and Teacher Hiring in New Orleans,2018,
Reframing the future the role of reflexivity in governance networks in sustainability transitions,2018,
Regional structures of feeling? A spatially and socially differentiated analysis of UK student im/mobility,2018,
Relationships Among Teachers' Formal and Informal Positions and Their Incoming Student Composition,2018,
Relationships in early childhood education  beyond the professional into the personal within the teacherchild dyad relationships 'that ripple in the pond',2018,
Remodelling urban planning education for sustainable development the case of Serbia,2018,
Rendering controversial socioscientific issues legible through digital mapping tools,2018,
Research and Innovation on ChineseForeign Cooperation in Running Schools in Tourism Education,2018,
Research and Practice on Innovative Methods of Ideological and Political Education for College Students Based on Internet of Things plus Technologies,2018,
Research on Innovative Methods of College Students' Sports Teaching Based on Internet Education Technology,2018,
Research on Oral English Flipped Classroom Projectbased Teaching Model Based on Cooperative Learning in China,2018,
Research on Organization of Mathematics Knowledge in Good Mathematical Cognitive Structure,2018,
Research on Teaching Chinese as a Second or Foreign Language in and Outside Mainland China A Bibliometric Analysis,2018,
Research on the Impact of Internet Development on the Quality of China's Higher Education,2018,
Research topics and trends in medical education by social network analysis,2018,
Researchbased Teaching Model of Ideological and Political Course Under Computer Network Environment,2018,
Researching 'messy objects' how can boundary objects strengthen the analytical pursuit of an actornetwork theory study?,2018,
Resegregation in Desegregated Schools? Ethnic Boundary Making between Students in Everyday School Life,2018,
Responding to Big Data in the Art Education Classroom Affordances and Problematics,2018,
Rethinking SchoolBased Ties Social Class and the Role of Institutional Agents in Adolescents' College Plans,2018,
Saving the world through neoliberalism philanthropic policy networks in the context of Spanish education,2018,
Scholars in an increasingly open and digital world imagined audiences and their impact on scholars' online participation,2018,
School social work and the human right to education,2018,
Schoolbased sports development and the role of NSOs as boundary spanners' benefits disbenefits and unintended consequences of the Sporting Schools policy initiative,2018,
Schooltoschool support within a competitive education system views from the inside,2018,
Searching for buried treasure uncovering discovery in discoverybased learning,2018,
Selection of Cooperative Enterprises in Vocational Education Based on ANP,2018,
Selfassessment to incite learning in higher education developing ontological awareness,2018,
Selfcare and entrepreneurism an ethnography of soft skills development for higher education staff,2018,
Selling tech to teachers education trade shows as policy events,2018,
Share and succeed the development of knowledge sharing and brokerage in data teams' network structures,2018,
Shifting Global Literacy Networks How Emigration Promotes Informal Literacy Learning in Latvia,2018,
SITS A solutionbased intelligent tutoring system for students' acquisition of problemsolving skills in computer programming,2018,
Simply the best Professors nominated by students for their exemplary technology practices in teaching,2018,
Snapchat' youth subjectivities and sexuality disappearing media and the discourse of youth innocence,2018,
Social learning through rural communities of practice Empirical evidence from farming households in the Vietnamese Mekong Delta,2018,
Social Media and Networking Competencies for Psychiatric Education Skills Teaching Methods and Implications,2018,
Social media diaries and fasts Educating for digital mindfulness with preservice teachers,2018,
Social media networks and pedagogy at the University of Jordan,2018,
Social media use by instructional design departments,2018,
Social mediabased collaborative learning Exploring antecedents of attitude,2018,
Social Movements and Educational Research Toward a United Field of Scholarship,2018,
Social network analysis of international student mobility uncovering the rise of regional hubs,2018,
Social network site use and academic achievement A metaanalysis,2018,
Social Networking and Academic Performance A Generalized Structured Component Approach,2018,
Social networking as a strategic tool in the management of schoolbased violence,2018,
Social Networking Sites as Formal Learning Environments in Business Education,2018,
Social Networks and Minority Male College Access The Tip of the Iceberg Phenomena,2018,
Social Stratification and Studying Overseas Empirical Evidence from Middle Schools in Beijing,2018,
SPORT AND LEISURE POLICIES FOR PEOPLE WITH DISABILITIES,2018,
Sport Theology and Dementia Reflections on the Sporting Memories Network UK,2018,
STEM education centers catalyzing the improvement of undergraduate STEM education,2018,
Strategies for the communication and collaborative online work by university students,2018,
Strengthening networks A social network intervention among higher education teachers,2018,
Strengthening Social Networks in Online Discussion Forums to Facilitate Help Seeking for Solving Problems,2018,
Stressing the journey using life stories to study medical student wellbeing,2018,
Studentinitiated Facebook sites nurturing personal learning environments or a place for the disenfranchised?,2018,
Students' Internet Addiction Study and Prevention,2018,
Students' Perception of the Importance of Using Facebook for Academic Purposes,2018,
Study on College English Teaching Interaction and Teaching Practice Based on Connectivism from the Neurocognitive Perspective,2018,
Study on College English Teaching Interaction and Teaching Practice Based on Connectivism from the Neurocognitive Perspective,2018,
Study on student performance estimation student progress analysis and student potential prediction based on data mining,2018,
StudyAbroad Experiences of Two South Korean Undergraduate Students in an EnglishSpeaking and a NonEnglishSpeaking Country,2018,
Supervised machine learning in multimodal learning analytics for estimating success in projectbased learning,2018,
Supporting aboriginal and Torres Strait islander cultural educators and cultural mentors in Australian general practice education,2018,
Supporting instructional change in mathematics using social network analysis to understand online support processes following professional development workshops,2018,
Supporting the career decisions of Australianbased international Chinese doctoral students,2018,
Sustainability Governance at Universities Using a Governance Equalizer as a Research Heuristic,2018,
System learning in an urban school district A case study of intradistrict learning,2018,
TEACHER LEADERS AS AGENTS OF CHANGE Creating Contexts for Instructional Improvement for English Learner Students,2018,
Teachers' Insights Into Connected Learning Networks Emerging Activities and Forms of Participation,2018,
Teachers' intergenerational advice and information seeking content matters!,2018,
Teachers' motives for learning in networks costs rewards and community interest,2018,
Teachers' perceptions towards using Web 2.0 in language learning and teaching,2018,
Teachers' use of Facebook and teacher quality developing a Facebook Effect Scale on Teacher Quality (FESTQ)' from the perspective of PCK TPACK and lifelong learning frameworks,2018,
Teaching Exploration of Hydraulic Structure Model Experiment Course,2018,
Teaching Innovation Methods of Computerassisted Geographic Information Technology,2018,
Teaching STEM after school Correlates of instructional comfort,2018,
Technocentrism and social fields in the Indian EdTech movement formation reproduction and resistance,2018,
Temporalities of learning lessons from a sociomaterial study of allotment gardening practice,2018,
Thanks shokran gracias Translingual practices in a Facebook group,2018,
The 1910 Edinburgh World Missionary Conference and comparative colonial education,2018,
The 2012 sandy hook elementary school shooting Connecticut's department of mental health crisis response,2018,
The changing nature of expertise insights from the case of TAVI,2018,
THE COGNITIVE STRUCTURE OF PRESERVICE SCIENCE TEACHERS ABOUT ENERGY METABOLISM,2018,
The collocation networks of stance phrases,2018,
The Common Core debate on Twitter and the rise of the activist public,2018,
The cultivation of research labor in Pacific Asia with special reference to Singapore,2018,
The effect of social media multitasking on classroom performance,2018,
The effects of Facebook and WhatsApp on success in English vocabulary instruction,2018,
The ethnicity attainment gap among medical and biomedical science students a qualitative study,2018,
The family key agent in youth empowerment in ICT society,2018,
The hidden architecture of higher education building a big data infrastructure for the 'smarter university',2018,
The Influence and Analysis of Network Multimedia Teaching Management on College Psychological Teaching Model,2018,
The Influence of Social Contagion Within Education A Motivational Perspective,2018,
The impact of economic plans on the Chinese education system machine learning approach,2018,
The interaction between social capital creativity and efficiency in organizations,2018,
The many faces of scientific inquiry Effectively measuring what students do and not only what they say,2018,
The moderating effect of experience on the intention to adopt mobile social network sites for pedagogical purposes An extension of the technology acceptance model,2018,
The national politics of educational advocacy in the context of global governance international funding and support for civil society engagement in Cambodia,2018,
The Next Generation Scientist program capacitybuilding for future scientific leaders in low and middleincome countries,2018,
The opportunities of networks of researchpractice partnerships and why CSCL should not give up on largescale educational change,2018,
The Panorama of the Last Decade's Theoretical Groundings of Educational Leadership Research A Concept CoOccurrence Network Analysis,2018,
The Perks of Being Peripheral English Learning and Participation in a Preschool Classroom Network of Practice,2018,
The policyscape of transgender equality and gender diversity in the Western Australian education system a case study,2018,
The power of networks in the marketing of pedagogical ideals the Dalton Plan in Great Britain (19201925),2018,
The Power of the Network Teach For America's Impact on the Deregulation of Teacher Education,2018,
The Research about Application of Computer Network Aided Instruction in Japanese Teaching Reform,2018,
The resilience of the MBA in emerging economies student motivations for wanting an MBA in China and the United Arab Emirates,2018,
