Title,Year,
A MODEL FOR LEARNINGRESOURCE NETWORKS FOR SENIOR ADULTS,1980,
BALANCE IN MEDICALEDUCATION NETWORKS,1980,
FAMILY INTERVENTION PROJECT  A FAMILY NETWORK MODEL FOR SERVING YOUNG HANDICAPPEDCHILDREN,1980,
KNOTS IN THE NETWORK OF INFORMATIONSOURCES ABOUT EDUCATION,1980,
PLANNING A STATEWIDE TRAINING NETWORK  A CASESTUDY IN DEVELOPING INTERORGANIZATIONAL RELATIONSHIPS,1980,
PROCEDURAL NETWORKS AND PRODUCTION SYSTEMS IN ADAPTIVE DIAGNOSIS,1980,
THE 1ST R  REASONING  A SKILL NETWORK FOR THE SOCIALSTUDIES CURRICULUM,1980,
A NETWORK FOR DIALOG  THE TEACHERS CENTERS EXCHANGE,1981,
A NETWORKING INFORMATIONPROCESSING STRATEGY AND THE LEARNING OF FIELD DEPENDENTS RECEIVING VISUAL INSTRUCTIONAL INFORMATION,1981,
A STUDY OF NETWORKS AMONG PROFESSIONAL STAFFS IN SECONDARYSCHOOLS,1981,
EGO DEVELOPMENT AND PEER FRIENDSHIP NETWORKS,1981,
SOCIAL NETWORKS AS SUPPORTS FOR PARENTING,1981,
THE NATIONAL DIFFUSION NETWORK,1981,
UPDATE ON THE NATIONAL DIFFUSION NETWORK,1981,
WHAT A TEACHER OF READING SHOULD KNOW ABOUT THE NATIONAL DIFFUSION NETWORK,1981,
A PROSE LEARNINGSTRATEGY TRAININGPROGRAM BASED ON NETWORK AND DEPTHOFPROCESSING MODELS,1982,
ART PARTNERSHIP NETWORK  A SUPPORTIVE PROGRAM FOR ARTISTICALLY GIFTEDCHILDREN,1982,
NETWORKING VS ROTE LEARNINGSTRATEGIES IN CONCEPTACQUISITION,1982,
PEER NETWORK THERAPY  AN INTERVENTION WITH THE SOCIAL CLIMATE OF STUDENTS IN RESIDENCE HALLS,1982,
EXPANDING OUR CHILD ADVOCACY EFFORTS  NAEYC FORMS A PUBLICPOLICY NETWORK FOR CHILDREN,1983,
SOCIAL NETWORK  A NEW PERSPECTIVE ON INDEPENDENCE AND ILLITERATE ADULTS,1983,
THE EDUCATIONAL POTENTIAL OF CABLETELEVISION NETWORKS IN THE UK,1983,
USING NETWORK ANALYSIS IN THE CLASSROOM,1983,
WISCONSINEDUCATIONALTELEPHONENETWORK  HOW TO RUN EDUCATIONAL TELECONFERENCING SUCCESSFULLY,1983,
COMMUNITY ORGANIZATIONS AND NETWORKING  STRATEGIES FOR INFLUENCING PUBLICPOLICY,1984,
IMPACTII  A TEACHERTOTEACHER NETWORKING PROGRAM,1984,
THE ASCD HIGHSCHOOL NETWORK  IMPRESSIONS FROM ON THE ROAD,1984,
AN HP67/97 NETWORK ANALYZER FOR EE STUDENTS,1985,
NEGATIVE INCENTIVE STEERING IN A POLICY NETWORK,1985,
THE SCIENCEEDUCATION INFORMATION NETWORK  A RAPID RESPONSE OPPORTUNITY FOR TEACHERS,1985,
YELLOW PAGES FOR PRINCIPALS  NETWORKS IN ACTION,1985,
A WORLDWIDE INTERCULTURAL NETWORK  EXPLORING ELECTRONIC MESSAGING FOR INSTRUCTION,1986,
MORE THAN GOOD INTENTIONS  BUILDING A NETWORK OF COLLABORATIVES,1986,
NETWORKING  A NEW WORD A DIFFERENT GAME,1986,
PRELIMINARYANALYSIS TO BUILD AN INTEGRATIVE CONCEPTUAL NETWORK FOR BIOLOGICAL EDUCATION AT UNIVERSITY LEVEL,1986,
THE BLACK FRESHMAN NETWORK,1986,
HUMANISTIC APPLICATION OF NETWORK NEWS,1987,
CONNECTING THE NETWORKS  AGING AND LIFELONG DISABILITIES,1988,
PC NETWORKS  USAGE AND GRAPHICS TUTORIALS,1988,
SUPPORTING PROFESSIONALDEVELOPMENT WITH IT NETWORKS,1988,
USE OF SYSTEMIC NETWORKS IN THE DEVELOPMENT OF A QUESTIONNAIRE,1988,
EDUCATIONAL CORRELATES OF INFORMAL NETWORKING BY GERONTOLOGICAL SOCIALWORKERS,1989,
RESEARCH LIBRARY NETWORKS  LEVERAGING THE BENEFITS,1989,
TEACHERS AS RESEARCHERS  THE 1ST CYCLE OF THE TEACHERS RESEARCH NETWORK,1989,
THE CHARINGCROSS AND WESTMINSTER INTERACTIVE TELEVISION NETWORK,1989,
THE EDUCATIONAL IMPORTANCE OF LOCAL AREA NETWORKS IN SECONDARYSCHOOLS,1989,
THE LISTENING COMPREHENSION EXERCISE NETWORK (LCEN)  A NATIONALLY AVAILABLE AID TO THE DEVELOPMENT OF LISTENING PROFICIENCY IN RUSSIAN,1989,
THE UNITEDNATIONSUNIVERSITY  A NETWORK WITH A GLOBAL MISSION,1989,
AIDS EDUCATION  AN OPPORTUNITY FOR INTERDISCIPLINARY NETWORKING,1990,
APPLICATION REPORT  NETWORK CAPABILITIES AND ACADEMIC REALITIES  IMPLEMENTING INTERACTIVE NETWORKING IN A COMMUNITYCOLLEGE ENVIRONMENT,1990,
BUILDING ELECTRONIC COMMUNITIES  SUCCESS AND FAILURE IN COMPUTER NETWORKING,1990,
CHANGES IN TEACHEREDUCATION  NEEDED LEADERSHIP AND NEW NETWORKS,1990,
INTEGRATED SERVICES DIGITAL NETWORKS AND DISTANCE EDUCATION,1990,
SEMANTIC NETWORKING  THE NEW KID ON THE BLOCK,1990,
A MINIINTERNATIONAL NETWORK FOR THE PRODUCTION OF COMPUTERASSISTEDLEARNING MATERIAL,1991,
A TRANSFER CREDIT EVALUATION SYSTEM FOR A STANDALONE PERSONALCOMPUTER OR A LOCAL AREA NETWORK,1991,
AN UNDERGRADUATE COURSE IN ARTIFICIAL NEURAL NETWORKS,1991,
CHANGING BALANCES IN DUTCH HIGHEREDUCATION,1991,
COMPUTERASSISTED SELFASSESSMENT (CASA) IN HISTOLOGY,1991,
COMPUTERS ELECTRONIC NETWORKING AND EDUCATION  SOME AMERICAN EXPERIENCES,1991,
ELECTRONIC NETWORKING IN SUPPORT OF SOUTHTOSOUTH COOPERATION,1991,
ENVIRONMENTALEDUCATION  THE DEVELOPMENT OF A CURRICULUM THROUGH GRASSROOTS RECONSTRUCTIVE ACTION,1991,
LEARNING THROUGH MULTIUSER NETWORK CAL,1991,
NARRATIVE DISCOURSE AND TEACHER KNOWLEDGE,1991,
ON TEACHERS PRACTICAL REASONING AND PROFESSIONAL KNOWLEDGE  CONSIDERING CONCEPTIONS OF CONTEXT IN TEACHERS THINKING,1991,
POINTS REGARDING THE STRENGTHENING OF THE COLLEGES AND UNIVERSITIES HORIZONTAL NETWORKING WITH THE ECONOMIC AND SCIENTIFICTECHNOLOGICAL CIRCLES  INSPIRATIONS AND LESSONS LEARNED FROM THE INVESTIGATIVE SURVEY OF THE HORIZONTAL NETWORKING RECENTLY LAUNCHED BY QINGHUAUNIVERSITY,1991,
ROLES AND RELATIONSHIPS IN QUALITATIVE RESEARCH ON TEACHERS THINKING  A RECONSIDERATION,1991,
SUPPORTING BEGINNING TEACHERS WITH COMPUTERNETWORKS,1991,
THE DESIGN AND EVALUATION OF A MULTIMEDIA AUTHORING SYSTEM,1991,
THE INTERACTIVE SCIENCE AND TECHNOLOGY PROJECT  THE NUFFIELDFOUNDATIONS LAUNCHPAD FOR A EUROPEAN COLLABORATIVE,1991,
A DESCRIPTIVE ANALYSIS AND ACADEMIC GENEALOGY OF MAJOR CONTRIBUTORS TO JTPE IN THE 1980S,1992,
ACADEMIC STRESS OF INTERNATIONAL STUDENTS ATTENDING UNITEDSTATES UNIVERSITIES,1992,
APPLICATION REPORT  NETWORK USE IN CENTRAL MANAGEMENT OF LARGE UNIVERSITY PHYSICS COURSES,1992,
ASSISTANCE TO AIDS ORPHANS WITHIN THE FAMILY KINSHIP SYSTEM AND LOCAL INSTITUTIONS  A PROGRAM FOR EASTAFRICA,1992,
BENEFITS ADULTS EXPERIENCE THROUGH PARTICIPATION IN CONTINUING HIGHEREDUCATION,1992,
BUILDING A PARTNERSHIP OF UNIVERSITY RESOURCES AND RURAL SERVICE PROVIDERS  A CASESTUDY,1992,
CAMCE  AN ENVIRONMENT TO SUPPORT MULTIMEDIA COURSEWARE PROJECTS,1992,
CASESTUDY  A FUTURE FOR ELECTRONIC COMMUNICATIONS IN EDUCATION,1992,
CASESTUDY  SUPPORTING THE STRUCTURING OF PERSONAL KNOWLEDGE WITH COMPUTERS,1992,
COMPUTERBASED SIMULATION SYSTEMS AND ROLEPLAYING  AN EFFECTIVE COMBINATION FOR FOSTERING CONDITIONAL KNOWLEDGE,1992,
COMPUTERNETWORKS AS A NEW DATABASE,1992,
COMPUTERS IN THE TEACHING OF LIBRARY AND INFORMATION STUDIES IN THE UNITEDKINGDOM,1992,
ELECTRONIC NETWORKING AND THE CONSTRUCTION OF PROFESSIONAL KNOWLEDGE,1992,
EUROPEANIZATION OF IRISH UNIVERSITIES,1992,
EXPLOITING COMPUTERBASED SIMULATIONS FOR LANGUAGELEARNING PURPOSES,1992,
GENERATIVE ASPECTS OF THE COMPUTERBASED EDUCATIONAL SOFTWARE SYSTEM (CBESS),1992,
GENERATIVE ASPECTS OF THE COMPUTERBASED EDUCATIONAL SOFTWARE SYSTEM (CBESS),1992,
IMAGE AND EXPERIENCE OF CONTEMPORARY PUBLICSCHOOLS  INFORMAL PROCESSES AND THE POSTSCHOOL TRANSITION,1992,
INTERORGANIZATIONAL RESPONSES TO AIDS  A CASESTUDY OF THE WORCESTER AIDS CONSORTIUM,1992,
KAZZIES DBTS AND TRYHARDS  CATEGORIZATIONS OF STYLE IN ADOLESCENT GIRLS TALK,1992,
LEARNING AS AN INDICATOR OF EDUCATIONAL QUALITY,1992,
LEARNING FROM LOCAL KNOWLEDGE TO IMPROVE DISEASE SURVEILLANCE  PERCEPTIONS OF THE GUINEA WORM ILLNESS EXPERIENCE,1992,
MIDDLE SCHOOLS AND MATH GROUPS  PARENTS INVOLVEMENT IN CHILDRENS PLACEMENT,1992,
NETWORKS FOR EDUCATIONALCHANGE  POWERFUL AND PROBLEMATIC,1992,
NEW PERSPECTIVES ON AN OLD PROBLEM  THE POSITION OF WOMEN ACADEMICS IN BRITISH HIGHEREDUCATION,1992,
OPINION  LEARNING IN THE NEURAL ORGANIZATION,1992,
PRODUCTIVITY TOOLS FOR SIMULATIONCENTERED TRAINING DEVELOPMENT,1992,
SOURCES OF CAREER SUPPORT FOR UNIVERSITYFACULTY,1992,
THE CHANGING LOOK OF EDUCATIONS POLICY NETWORKS,1992,
THE DEPICTION OF GUNS ON PRIMETIME TELEVISION,1992,
THE FUTURE OF COMPUTERS IN TEACHING AND LEARNING,1992,
THE POTENTIAL OF COMPUTERBASED TELECOMMUNICATIONS FOR INSTRUCTION,1992,
THE ROLE OF EDUCATION IN A PROGRAM TO TREAT DEPRESSION IN OLDER WOMEN,1992,
THE USE OF SYNCHRONOUS COMPUTERNETWORKS IN 2ND LANGUAGE INSTRUCTION  A PRELIMINARYREPORT,1992,
ACQUIRING STRUCTURAL KNOWLEDGE FROM SEMANTICALLY STRUCTURED HYPERTEXT,1993,
AFRICANAMERICAN UNDERGRADUATES ON A PREDOMINANTLY WHITE CAMPUS  ACADEMIC FACTORS SOCIAL NETWORKS AND CAMPUS CLIMATE,1993,
AN EPISTEMOLOGICAL STUDY OF THE CHILDS CONSTRUCTION OF EARLY ARITHMETIC,1993,
CAMPUS COMPUTING  A BIG APPROACH BY A SMALL COLLEGE,1993,
CASES HYPERMEDIA AND COMPUTERNETWORKS  3 CURRICULAR INNOVATIONS FOR TEACHEREDUCATION,1993,
CHANGES IN KNOWLEDGE STRUCTURES FROM BUILDING SEMANTIC NET VERSUS PRODUCTION RULE REPRESENTATIONS OF SUBJECT CONTENT,1993,
DEDUCTIVE REASONING BRAIN MATURATION AND SCIENCE CONCEPTACQUISITION  ARE THEY LINKED,1993,
DISSEMINATION AND USE OF A SCHOOLBASED NUTRITION EDUCATIONPROGRAM FOR SECONDARYSCHOOL STUDENTS,1993,
ENVIRONMENTAL APPROACH USED FOR EVALUATING AN EDUCATIONALINNOVATION,1993,
FACILITATIVE POWER AND NONSTANDARDIZED SOLUTIONS TO SCHOOL SITE RESTRUCTURING,1993,
FUTUREISSUES OF COMPUTERMEDIATED COMMUNICATION  THE RESULTS OF A DELPHI STUDY,1993,
HIGHSCHOOL AS AN ARENA FOR CULTURALCONFLICT AND ACCULTURATION FOR LATINO ANGELINOS,1993,
HYPERMEDIA GENERATION FROM DOMAIN REPRESENTATIONS,1993,
INFORMATIONSCIENCE IN THE UNIVERSIDADAUTONOMADEMADRID  DEVELOPMENTS WITH THE TIMES,1993,
LIBRARIANS IN THE NEW EUROPE  TRAINING AND EDUCATION NEEDS OF LIBRARIANS WORKING IN NATIONAL LIBRARIES,1993,
MENTORING PROBATIONARY WOMEN ACADEMICS  A PILOT PROGRAM FOR CAREERDEVELOPMENT,1993,
ONLINE PLACEMENT TESTING IN MATHEMATICS AND CHEMISTRY,1993,
PARTNERS IN EXCELLENCE  A NEW MODEL FOR COOPERATIVE EDUCATION,1993,
PUBLICLIBRARY LEADERS AND RESEARCH  MECHANISMS PERCEPTIONS AND STRATEGIES,1993,
SCHOOL COUNSELORS AND GUIDANCE NETWORKS  ROLES REVISITED,1993,
SERVICE PROVIDERS KNOWLEDGE AND MISCONCEPTIONS ABOUT OLDAGE  COMPARISON OF 3 SERVICE NETWORKS,1993,
SOCIAL NETWORK SUPPORT AND INFLUENCE  RELATIONSHIPS WITH DRUGUSE AND PROTECTIVE AIDS BEHAVIOR,1993,
SOCIAL NETWORKS AND HOMESCHOOL RELATIONS,1993,
SPORT AND PHYSICALEDUCATION AND THE NEWWORLD ORDER  DARE WE BE AGENTS OF SOCIALCHANGE,1993,
SURVIVORS IN A MALE PRESERVE  A STUDY OF BRITISH WOMEN ACADEMICS EXPERIENCES AND PERCEPTIONS OF DISCRIMINATION IN A UK UNIVERSITY,1993,
TEACHING ABOUT OLDERPEOPLE WITH MENTALRETARDATION  AN EDUCATIONALMODEL,1993,
TEACHING DATA COMMUNICATIONS AND COMPUTERNETWORKS  A COURSE DESCRIPTION,1993,
THE DEVELOPMENT THEORY AND APPLICATION OF A COGNITIVENETWORK MODEL OF PREDICTIONPROBLEM SOLVING IN BIOLOGY,1993,
THE EVOLUTION OPERATION AND FUTURE OF MINNESOTA SAFPLAN  A COALITION FOR FAMILYPLANNING,1993,
THE IMPACT OF SUPPORTIVE COMMUNICATIONNETWORKS ON TEST ANXIETY AND PERFORMANCE,1993,
THE TEMPORAL STRUCTURE OF ADULTEDUCATION  REFLECTIONS ON A TIMEFOCUSED THEORETICAL RECONSTRUCTION OF THE SYSTEM OF FURTHER EDUCATION,1993,
UNDERSTANDING BIOSYSTEM ORGANIZATION .2. TOWARDS A THEORETICAL FRAMEWORK,1993,
USING COMPUTERNETWORKS TO ENHANCE FOREIGNLANGUAGE CULTURE EDUCATION,1993,
USING REGIONAL SCHOOL NETWORKS TO ORCHESTRATE REFORM IN CALIFORNIA MIDDLE GRADES,1993,
YOUNG CHILDRENS (711) IDEAS ABOUT LIGHT AND THEIR DEVELOPMENT,1993,
30SOMETHING YEARS OF INTERNATIONALBUSINESS SIMULATIONS,1994,
A NEURALNETWORKBASED DIFFERENTIALDIAGNOSIS ASSESSMENT INSTRUMENT,1994,
AN ECOLOGICAL FRAMEWORK FOR CONCEPTUALIZING EDUCATIONAL RISK,1994,
AUTOMATED PARALLEL TESTCONSTRUCTION USING CLASSICAL TEST THEORY,1994,
CAREGIVING IN SOCIALCONTEXT,1994,
COLLABORATIVE HEALTHEDUCATION TRAINING FOR AFRICANAMERICAN HEALTH MINISTERS AND PROVIDERS OF COMMUNITYSERVICES,1994,
COMPUTERBASED TOOLS TO SUPPORT LEARNING FROM HYPERTEXT  CONCEPT MAPPING TOOLS AND BEYOND,1994,
COMPUTERMEDIATED COMMUNICATION IN INSTRUCTIONAL SETTINGS  A RESEARCH AGENDA,1994,
DO BAD PROGRAMS ALWAYS DRIVE OUT GOOD  A CASESTUDY IN FREEMARKET RELIGIOUSEDUCATION,1994,
EFFECTS OF LEARNER CONTROL ADVISEMENT AND PRIOR KNOWLEDGE ON YOUNG STUDENTS LEARNING IN A HYPERTEXT ENVIRONMENT,1994,
EFFECTS OF LEARNER CONTROL ADVISEMENT AND PRIOR KNOWLEDGE ON YOUNG STUDENTS LEARNING IN A HYPERTEXT ENVIRONMENT,1994,
ELECTRONICNETWORK RESOURCES FOR COMMUNICATION SCHOLARS,1994,
ESL VERSUS MAINSTREAM CLASSES  CONTRASTING L2 LEARNING ENVIRONMENTS,1994,
EVALUATION OF 2 AIDS EDUCATIONPROGRAMS FOR IMPOVERISHED LATINA WOMEN,1994,
FISHING WITH THE NET FOR RESEARCH DATA,1994,
HYPERMEDIA COMPUTERBASED EDUCATION IN SOCIALWORK EDUCATION,1994,
IMPLEMENTING PROGRAM EQUITY  RAISING THE STAKES FOR EDUCATIONALPOLICY AND PRACTICE,1994,
IMPLICATIONS OF A PEER TELEPHONE NETWORK ON ADULT LEARNER GPA AND RETENTION,1994,
INTEREST PRIOR KNOWLEDGE AND LEARNING,1994,
LIFEHISTORIES AND DEVELOPMENT OF NEW FORMS OF VITAL KNOWLEDGE,1994,
LOGICIEL SANS FRONTIERES,1994,
MENTORING AND OTHER SUPPORT BEHAVIORS IN ELEMENTARYSCHOOLS,1994,
METAPHORS AND PROTOTYPES IN THE LEARNING TEACHING OF GRAMMAR AND VOCABULARY,1994,
NETWORK REPRESENTATIONS OF KNOWLEDGE ABOUT CHEMICALEQUILIBRIUM  VARIATIONS WITH ACHIEVEMENT,1994,
NEURAL NETWORKS FOR READABILITY ANALYSIS,1994,
ORGANIZATIONS OR COMMUNITIES  CHANGING THE METAPHOR CHANGES THE THEORY,1994,
PERPETUATION THEORY AND THE LONGTERM EFFECTS OF SCHOOLDESEGREGATION,1994,
RUSSIAN REFUGEE FAMILIES  ACCOMMODATING ASPIRATIONS THROUGH EDUCATION,1994,
SCHOOL LEADERSHIP AND PERFORMANCE  A SOCIAL NETWORK APPROACH,1994,
SOCIAL NETWORKS OF CHILDREN ATTENDING HEADSTART FROM THE PERSPECTIVE OF THE CHILD,1994,
SOCIAL SUPPORT AND SEXUAL RISKTAKING AMONG WOMEN ON METHADONE,1994,
SPECIALEDUCATION CENTERS AS COOPERATIVE MODELS OF NETWORKORIENTED IN HUNGARY,1994,
TEACHING ABOUT GENDER  THE EXPERIENCE OF FAMILY CARE OF FRAIL ELDERLY RELATIVES,1994,
TEACHING IT SKILLS TO LIBRARY AND INFORMATION STUDIES STUDENTS  SOME REFLECTIONS,1994,
THE CAPACITYBUILDING APPROACH TO INTERVENTION MAINTENANCE IMPLEMENTED BY THE STANFORD5CITYPROJECT,1994,
THE INFORMATION STANDARD  WHAT IT IS HOW IT AFFECTS LIBRARIANSHIP AND WHY IT HAS BEEN OVERLOOKED,1994,
THE INSTITUTIONAL SOURCES OF EDUCATIONALREFORM  THE CASE OF SCHOOLBASED MANAGEMENT,1994,
THE MISSING LINK IN SCHOOLLINKED SOCIALSERVICE PROGRAMS,1994,
THE NATIONALNETWORKFOREDUCATIONALRENEWAL,1994,
THE QUIZ GAME  WRITING AND EXPLAINING QUESTIONS IMPROVE QUIZ SCORES,1994,
THE REALWORLD CONNECTION,1994,
THEORIZING THE GOVERNANCE OF EDUCATION,1994,
UTILIZING A LOCALAREA NETWORK FOR LIBRARY AND INFORMATIONSCIENCE EDUCATION,1994,
A GLOBAL PERFORMANCE SUPPORT SYSTEM FOR STUDENTS AND STAFF,1995,
A GRADUATES AND EMPLOYERS DATABASE SYSTEM AS A STRATEGIC RESOURCE FOR GEOGRAPHY DEPARTMENTS,1995,
A PLACE AT THE TABLE  THE CHANGINGROLE OF URBAN PUBLICEDUCATION FUNDS,1995,
ANALYSIS OF THE EFFECT OF NETWORKING ON COMPUTERASSISTED COLLABORATIVE WRITING IN A 5THGRADE CLASSROOM,1995,
ARILAB  MODELS ISSUES AND STRATEGIES IN THE DESIGN OF A MULTIPLETOOLS PROBLEMSOLVING ENVIRONMENT,1995,
ASPECTS OF LITERARY RESPONSE  A NEW QUESTIONNAIRE,1995,
Audience awareness in technologymediated environments,1995,
Barriers to mammography among Chinese women in Singapore A focus group approach,1995,
Cinegrams for selfdirected learning,1995,
COLLABORATIVE NETWORKED HYPERMEDIA EDUCATION  LESSONS FROM THE NERO PROJECT,1995,
COMMUNICATING AT A DISTANCE  A STUDY OF INTERACTION IN A DISTANCE EDUCATION CLASSROOM,1995,
COMPUTERASSISTED GAMING FOR ENTREPRENEURSHIP EDUCATION,1995,
COMPUTERSUPPORTED COLLABORATIVE LEARNING IN SCHOOLS  A DISTRIBUTED APPROACH,1995,
CONFERENCESTYLE LEARNING  A METHOD FOR FOSTERING CRITICAL THINKING WITH HEART,1995,
COOPERATIVE LEARNING AND DEVELOPMENT NETWORKS,1995,
CREATING COMMUNITIES OF READERS  A STUDY OF CHILDRENS INFORMATION NETWORKS AS MULTIPLE CONTEXTS FOR RESPONDING TO TEXTS,1995,
DELIVERING SERVICES IN RURALAREAS  USING CHILDCARE RESOURCEANDREFERRAL NETWORKS,1995,
EDUCATIONAL EQUITY ISSUES IN AN INFORMATION AGE,1995,
Facing the future surviving the present Strategies for women graduate students in geography,1995,
FUTURISTIC FACULTYDEVELOPMENT  A COLLEGIATE DEVELOPMENT NETWORK,1995,
GOALS DEVELOPMENT AND STRATEGIES OF A COALITION OF ONTARIO UNIVERSITIES,1995,
HOW KL2 TEACHERS ARE USING COMPUTERNETWORKS,1995,
INSTITUTIONALIZING CROSSCULTURAL EXPERIENCES AND INTERNATIONAL EXPERTISE IN TEACHEREDUCATION  THE DEVELOPMENT AND POTENTIAL OF A GLOBAL EDUCATION PDS NETWORK,1995,
INTEGRATION OF COMPUTERTECHNOLOGY AND INTERACTIVE LEARNING IN GEOGRAPHIC EDUCATION,1995,
INTERNET AND ACADEMIC TEACHING IN AUSTRALIA,1995,
LABNET  AN INTENTIONAL ELECTRONIC COMMUNITY FOR PROFESSIONALDEVELOPMENT,1995,
LEADERSHIP AS AN ORGANIZATIONAL QUALITY,1995,
MODELBASED ANALYSIS AND REASONING IN SCIENCE  THE MARS CURRICULUM,1995,
Modeling the student in intelligent tutoring systems The promise of a new psychometrics,1995,
NARRATIVES OF VOLUNTEERING,1995,
NAVAJO MOTHERS AND DAUGHTERS  SCHOOLS JOBS AND THE FAMILY,1995,
POLICY COMMUNITIES ISSUE NETWORKS AND THE FORMULATION OF AUSTRALIAN HIGHEREDUCATION POLICY,1995,
REACTIONS FROM THE FIELD TO STATE RESTRUCTURING LEGISLATION,1995,
REEXAMINING SOCIALSCIENCE RESEARCH ON SCHOOLDESEGREGATION  LONGVERSUS SHORTTERM EFFECTS,1995,
REMOTE EXPLORATORIUMS  COMBINING NETWORK MEDIA AND DESIGN ENVIRONMENTS,1995,
RESTRUCTURING CLASSROOM INTERACTION WITH NETWORKED COMPUTERS  EFFECTS ON QUANTITY AND CHARACTERISTICS OF LANGUAGE PRODUCTION,1995,
SCHOOLING WELFARE AND THE POLICING OF PARENTS,1995,
SHARE GLOBALLY ADAPT LOCALLY  SOFTWARE ASSISTANCE TO LOCATE AND TAILOR CURRICULUM POSTED TO THE INTERNET,1995,
SOCIAL AND SEXUAL NETWORKS  THEIR ROLE IN THE SPREAD OF HIV/AIDS AMONG YOUNG GAY MEN,1995,
SOCIAL CAPITAL AND THE REPRODUCTION OF INEQUALITY  INFORMATION NETWORKS AMONG MEXICANORIGIN HIGHSCHOOLSTUDENTS,1995,
STAFF EMPOWERMENT AND LIBRARY IMPROVEMENT THROUGH NETWORKING,1995,
SUCCESSFUL AND LESSSUCCESSFUL RESEARCH PERFORMANCE OF JUNIOR FACULTY,1995,
The diffusion of epidemics on networks,1995,
THE GENERAL AND THE SPECIFIC IN SOCIOPEDAGOGICAL AND PSYCHOANALYTIC CASE ANALYSIS,1995,
THE IMPACT OF AN INTERACTIVE DISTANCE LEARNING NETWORK ON CLASSROOM COMMUNICATION,1995,
The International Student Exchange Network 1970 and 1989,1995,
THE INTERNET AS A K12 EDUCATIONAL RESOURCE  EMERGING ISSUES OF INFORMATION ACCESS AND FREEDOM,1995,
THE KIDS NETWORK  STUDENTSCIENTISTS POOL RESOURCES,1995,
The Maori and Pacific Islands school retention policy 19901991 Lessons learned,1995,
The myth of reverse discrimination in higher education,1995,
THE NEBRASKA NETWORK OF DRUGFREE YOUTH PROGRAM,1995,
THE NORWEGIAN JITOL EXPERIENCE AND NITOL AS A NATIONAL EXTENSION,1995,
THE ONTOLOGY OF PHYSICAL EVENTS  A COMPARISON OF 2 GROUPS,1995,
The potential impact of highspeed networking on teaching and learning A case study from Cambridge university,1995,
THE PROCESS OF INTRODUCING INTERNETBASED CLASSROOM PROJECTS AND THE ROLE OF SCHOOL LIBRARIANS,1995,
WIDEAREA NETWORKING IN K12 EDUCATION  ISSUES SHAPING IMPLEMENTATION AND USE,1995,
A multidisciplinary course for gerontology faculty from Nordic countries,1996,
Aggressive behavior in preschoolers' social networks Do birds of a feather flock together?,1996,
An analysis of conference interactions on TeleNex  A computer network for ESL teachers,1996,
Applying standard network analysis to hypermedia systems Implications for learning,1996,
Assessing hypermedia navigation through Pathfinder Prospects and limitations,1996,
Assistants for assessment,1996,
'BCK2SKOL'' A networked learning model classroom,1996,
Career development for the language professional,1996,
Changing classroom practices through teacher networks Matching program features with teacher characteristics and circumstances,1996,
Children's approaches to the concept of volume,1996,
Classroom dynamics The impact of a technologybased curriculum innovation on teaching and learning,1996,
Comparative study of the information developed from messages containing picture and text,1996,
Constructing a cooperative distance learning system The CORAL experience,1996,
Conversations with a Latina teacher about education for languageminority students with special needs,1996,
Conversations within primary school parties visiting animal specimens in a museum and zoo,1996,
Cooperation and tension between autonomous schools A study of interschool networking,1996,
Demand and supply Meeting the need for teachers in the 'new' Russian school,1996,
Designing effective video teletraining instruction The Florida teletraining project,1996,
Economics on the Internet Electronic mail in the classroom,1996,
EDUCATE The design and development of a networked enduser education program,1996,
Education 2000 Implications of W3 technology,1996,
Entering the European educational scene through TEMPUS,1996,
Evaluation of an interdisciplinary faculty development program in geriatrics,1996,
Exploring learning opportunities in coordinated networkenhanced classrooms A case of kids as global scientists,1996,
Integrating research and development in the National Schools Network,1996,
Investigating learning styles on different hypertext environments Hierarchicallike and networklike structures,1996,
Knowledge structuring in instruction  Recent research on knowledge representation and its application in the classroom,1996,
Linking reading comprehension instruction to language development for languageminority students,1996,
Living networks,1996,
Managing models of collaborative learning,1996,
National information infrastructure policy and the future of the American welfare state Implications for the social welfare policy curriculum,1996,
Needs assessment for an urban native HIV and AIDS prevention program,1996,
NetLinkS A national professional development project for networked learner support,1996,
Network terms to get you through the 1990s,1996,
Networks and reform in American education,1996,
Networks for modernizing secondary schools,1996,
Perception of social support acculturation depression and suicidal ideation among African American college students at predominantly black and predominantly white universities,1996,
Political science and the comparative study of policy change in higher education Theoreticomethodological notes from a policy perspective,1996,
Problem of individualism in familyschool policies,1996,
Quality teacher education via distance mode A Caribbean experience,1996,
Research mentor A tool to aid in the training of scientific investigators,1996,
Research summary  Educational electronic networks,1996,
Role changes for the academic librarian to support effectively the networked learner Implications of the IMPEL Project,1996,
School organization and market ecology A realist sociological look at the infrastructure of school choice,1996,
Social network characteristics and college adjustment among racially and ethnically diverse firstyear students,1996,
Social support networks of successful university students A study of race ethnicity and sex,1996,
Student involvement with the regionally important geomorphological site (RIGS) scheme An opportunity to learn geomorphology and gain transferable skills,1996,
Support issues for casebased learning in an undergraduate human factors class,1996,
The adaptability of the health promoting schools concept A case study from Australia,1996,
The Cyberspace challenge Modernity postmodernity and reflections on international networking policy,1996,
The effects of students' computerbased prior experiences and instructional exposures on the application of hypermediarelated mental models,1996,
The great family network,1996,
The Internet An essential tool for college health networking,1996,
The importance of computer experience learning processes and communication patterns in multicultural networking,1996,
The reading strategies of bilingual Latina/o students who are successful English readers Opportunities and obstacles,1996,
The role of computerbased resources in health promotion and disease prevention Implications for college health,1996,
The use of videoconferencing to support learning An overview of issues relevant to the library and information profession,1996,
Towards a strategy for supporting distancelearning students through networked access to information Issues and challenges in preparing to support the Doctorate in Education,1996,
Voices from networked classrooms,1996,
A beginner's guide to the Internet in the foreign language classroom with a focus on the world wide web,1997,
A case of two paradigms within health education,1997,
A safe and caring place,1997,
Agricultural education at the crossroads Present dilemmas and possible options for the future in subSaharan Africa,1997,
An evaluation of coalition building training for aging and developmental disability service providers,1997,
An intelligent tutoring system for introductory C language course,1997,
Asynchronous learning Technology and pedagogical strategy in a distance learning course,1997,
Building social networks,1997,
Charting the outcomes of an interdisciplinary summer institute on gerontology,1997,
ComWeb An electronic classroom for teaching computer literacy,1997,
Consistency of students' explanations about combustion,1997,
Constructing collaborative learning activities for distance CAL systems,1997,
Continued risky injection subsequent to syringe exchange use among injection drug users in New York City,1997,
Describing the structure and content of interdisciplinary collaboration in an educational center on aging and health,1997,
Designing statesponsored teacher networks A comparison of two cases,1997,
Developing a cadre of educational managers,1997,
Do employers really need more educated youth?,1997,
'Do you want to be in my story?'' Collaborative writing in an urban elementary classroom,1997,
Educational reform in Great Britain  Restricted autonomy of schools and teachers,1997,
