Title,Year,
The Development of Polysemy and Frequency Use in English Second Language Speakers,2010,
The dynamics of an online knowledge building community A 5year longitudinal study,2010,
The effectiveness of a preparatory students programme on promoting peer acceptance of students with physical disabilities in inclusive schools of Tehran,2010,
The factors of early school dropout. Spain in the European context,2010,
The Implementation of TwoCycle Degree Structure in Hungary,2010,
The impact of electronic media on faculty evaluation,2010,
The need for innovative methods of teaching and learning chemistry in higher education  reflections from a project of the European Chemistry Thematic Network,2010,
The networked student model for construction of personal learning environments Balancing teacher control and student autonomy,2010,
The New Perspectives of Health Promoting Schools development  Current Situation in Europe and Poland,2010,
The Pacific way sustainability in higher education in the South Pacific Island nations,2010,
The Process of Probability Problem Solving Use of External Visual Representations,2010,
The Professional Careers of Graduates of a Management Faculty,2010,
The Role of ColorBlind Racial Attitudes in Reactions to Racial Discrimination on Social Network Sites,2010,
THE ROLE OF PEER SUPPORT ON CONDOM USE AMONG BLACK AND LATINO MSM IN THREE URBAN AREAS,2010,
The role of professional identity in patterns of use of multiplechoice assessment tools,2010,
The Sonic Imagination of Children in Andalusia A Musical Analysis of the TV Programme The Band,2010,
The Storytelling Project Model A Theoretical Framework for Critical Examination of Racism Through the Arts,2010,
The virtual campus of the future stimulating and simulating civic actions in a virtual world,2010,
Thirty Years of Distance Education Personal Reflections,2010,
Through green eyes complex visual culture and postliteracy,2010,
To Be or Not To Be Part of Them Micropolitical Challenges in Mainland Chinese Students' Learning of English in a Multilingual University,2010,
Topics and chains An approach to the analysis of joint meaning construction in asynchronous learning networks,2010,
Transitioning Academic and Social Performance of African Immigrant Students in an American High School,2010,
Troubles with grades grading and change Learning from adventures in alternative assessment practices in teacher education,2010,
Tutor response to implementing an ePortfolio to support learning and personal development in further and higher education institutions in Scotland,2010,
Two's up and poncing fags' young women's smoking practices reciprocity and friendship,2010,
Understanding the Emergence of Social Protocols on MySpace Impact and its Ramifications,2010,
Understanding vs. competency the case of accuracy checking dispensed medicines in pharmacy,2010,
Unpacking the inequality among Turkish schools Findings from PISA 2006,2010,
Using a social networking site for experiential learning Appropriating lurking modeling and community building,2010,
Using blogs to help language students to develop reflective learning strategies Towards a pedagogical framework,2010,
Using eJournals to Assess Students' Language Awareness and Social Identity During Study Abroad,2010,
Using network analysis to assess the evolution of organizational collaboration in response to a major environmental health threat,2010,
Validating Social and Cultural Capital of Hyperghettoized AtRisk Students,2010,
Violence on TV Analysis of Children's Programming,2010,
Virtual communities in schools as tools to promote social capital with high schools students,2010,
Virtual history a socially networked pedagogy of enlightenment,2010,
Webbased museum trails on PDAs for universitylevel design students Design and evaluation,2010,
Weblogs as instruments for reflection on action in teacher education,2010,
Who exactly is the moderator? A consideration of online knowledge management network moderation in educational organisations,2010,
Who matters to universities? A stakeholder perspective on humanities arts and social sciences valorisation,2010,
Who's citing whose writings? A corpus based study of citations as interpersonal resource in English medium national and English medium international journals,2010,
Who's citing whose writings? A corpus based study of citations as interpersonal resource in English medium national and English medium international journals,2010,
Why are English secondary schools socially segregated?,2010,
Why network? Theoretical perspectives on networking,2010,
Wizards and witches parent advocates and contention in special education in the USA,2010,
Working towards men's health Findings from the Sefton men's health project,2010,
WRITING/THINKING IN REAL TIME DIGITAL VIDEO AND CORPUS QUERY ANALYSIS,2010,
Young people social capital and networkbased educational decisionmaking,2010,
(Re)Defining Departure Exploring Black Professors' Experiences with and Responses to Racism and Racial Climate,2011,
(Un)veiling Desire Redefining relationships between gendered adult education subjects and adult education programmes,2011,
A case study of blogbased learning in Korea Technology becomes pedagogy,2011,
A Census chronicle  reflections on the campaign for a religion question in the 2001 Census for England and Wales,2011,
A collaborative multimedia annotation tool for enhancing knowledge sharing in CSCL,2011,
A CONTENT ANALYSIS OF AGING NETWORK CONFERENCE PROCEEDINGS,2011,
A course is a course is a course Factor invariance in student evaluation of online blended and facetoface learning environments,2011,
A Critical Analysis of the Research on Student Homelessness,2011,
A Dynamic Social Feedback System to Support Learning and Social Interaction in Higher Education,2011,
A gentlemanly pastime antiquarianism adult education and the clergy in England c.17501960,2011,
A JOYFUL CLASSROOM LEARNING SYSTEM WITH ROBOT LEARNING COMPANION FOR CHILDREN TO LEARN MATHEMATICS MULTIPLICATION,2011,
A Learning Content Authoring Approach based on Semantic Technologies and Social Networking an Empirical Study,2011,
A Network of Automatic Control WebBased Laboratories,2011,
A networked pathway to the PhD The AfricanNorwegian case of Productive Learning Cultures,2011,
A NEURAL NETWORK MODEL FOR PREDICTING CHILDREN'S MATHEMATICAL GIFT,2011,
A pedagogy of abundance,2011,
A Pedagogy of Abundance or a Pedagogy to Support Human Beings? Participant Support on Massive Open Online Courses,2011,
A positive postdoctoral experience is related to quality supervision and career mentoring collaborations networking and a nurturing research environment,2011,
A Qualitative Analysis of Success Stories From Michiana Coordinated School Health Leadership Institute Participants,2011,
Academic inbreeding exploring its characteristics and rationale in Japanese universities using a qualitative perspective,2011,
Accountability and Sanctions in English Schools,2011,
Active Agents The NewImmigrant Mothers' Figured Worlds of Home Literacy Practices for Young Children in Taiwan,2011,
Active Agents The NewImmigrant Mothers' Figured Worlds of Home Literacy Practices for Young Children in Taiwan,2011,
Adapting the Speed of Reproduction of Audio Content and Using Text Reinforcement for Maximizing the Learning Outcome though Mobile Phones,2011,
AFFECTING FACTORS AND OUTCOME ON INTERMITTENT INTERNET PULLING BEHAVIOR IN TAIWAN'S UNDERGRADUATE STUDENTS,2011,
AN AHPBASED WEIGHTED ANALYSIS OF NETWORK KNOWLEDGE MANAGEMENT PLATFORMS FOR ELEMENTARY SCHOOL STUDENTS,2011,
An Integrated DecisionMaking Framework for Sustainability Assessment A Case Study of Memorial University,2011,
An Upheaval in Higher Education Education by Competences,2011,
Anonymity in classroom voting and debating,2011,
ANT on the PISA Trail Following the statistical pursuit of certainty,2011,
Applying Constructionist Principles to Online Teacher Professional Development,2011,
Architecture for Building Conversational Agents that Support Collaborative Learning,2011,
Are digital natives a myth or reality? University students' use of digital technologies,2011,
Are We Supporting Teacher Success Insights From an Alternative Route Mathematics Teacher Certification Program for Urban Public Schools,2011,
Are We Supporting Teacher Success Insights From an Alternative Route Mathematics Teacher Certification Program for Urban Public Schools,2011,
Art for a few exclusions and misrecognitions in higher education admissions practices,2011,
Aspects of schooluniversity research networks that play a role in developing sharing and using knowledge based on teacher research,2011,
Aspiration for global cultural capital in the stratified realm of global higher education why do Korean students go to US graduate schools?,2011,
Assembling the Accomplished' Teacher The performativity and politics of professional teaching standards,2011,
Assessing elearning 2.0 system success,2011,
Because We Feel the Pressure and We Also Feel the Support Examining the Educational Success of Undocumented Immigrant Latina/o Students,2011,
Beginning Teachers' Workplace Experiences Perceptions of and Use of Support,2011,
Better serving the needs of limited English proficient (LEP) students in the mainstream classroom examining the impact of an inquirybased hybrid professional development program,2011,
Between forwarding and mentoring a qualitative study of recommending medical doctors for international postdoctoral research positions,2011,
Between work and learning on pedagogic practice and interstitial space,2011,
Beyond Discourse? Using Deleuze and Guattari's schizoanalysis to explore affective assemblages heterosexually striated space and lines of flight online and at school,2011,
Bibliometric and Social Network Analysis Applied to Television Dissertations Presented in Spain (1976/2007),2011,
Bridging research and practice Implementing and sustaining knowledge building in Hong Kong classrooms,2011,
Building a Political Constituency for Urban School Reform,2011,
Challenging assumptions Mobile Learning for Mathematics Project in South Africa,2011,
CHARACTERISTICS OF THE PETRINJA LOCAL IDIOM IN THE WORK BY MILAN DUJNIC CHRISTMAS IN PETRINJA  AN OVERVIEW OF CHRISTMAS CUSTOMS IN TWO ACTS,2011,
CHARACTERISTICS OF THE PETRINJA LOCAL IDIOM IN THE WORK BY MILAN DUJNIC CHRISTMAS IN PETRINJA  AN OVERVIEW OF CHRISTMAS CUSTOMS IN TWO ACTS,2011,
Charismatic cops patriarchs and a few good women leadership club culture and young peoples' drinking,2011,
Cognitive and Social Structure of the Elite Collaboration Network of Astrophysics A Case Study on Shifting Network Structures,2011,
Collaboration and Reflection as Strategies of Professionalization in school Networks,2011,
College students' text messaging use of textese and literacy skills,2011,
Communities of practice in a voluntary youth organisation reaching for the sky and building social capital,2011,
Communities of practice in a voluntary youth organisation reaching for the sky and building social capital,2011,
Conceiving land grant university community engagement as adaptive leadership,2011,
Connectivism Its Place in TheoryInformed Research and Innovation in TechnologyEnabled Learning,2011,
Contesting global neoliberalism and creating alternative futures,2011,
Convenience or credibility? A study of college student online research behaviors,2011,
Coping in an HIV/AIDSdominated context teachers promoting resilience in schools,2011,
Cortical network for reading linear words in an alphasyllabary,2011,
Critically Reflective Work Behaviour Within Autonomous Professionals' Learning Communities,2011,
Cross cultural analysis of the use and perceptions of web Based learning systems,2011,
Crosscultural adjustment of Nativespeaking English Teachers (NETs) in Hong Kong a factor in attrition and retention,2011,
CRUISING FOR TRUCKERS ON HIGHWAYS AND THE INTERNET SEXUAL NETWORKS AND INFECTION RISK,2011,
Defining the 'good mother' and the 'professional teacher' parentteacher relationships in an affluent school district,2011,
Design and Implementation Issues for Modern Remote Laboratories,2011,
Design sharing and coconstruction of learning resources A case of lifelong learning communities in Shanghai,2011,
Designing for Learning Online Social Networks as a Classroom Environment,2011,
Determinants of preventive health behavior in relation to cervical cancer screening among the female population of Belgrade,2011,
Devices and Educational Change,2011,
DIGITAL DIVIDES AND SOCIAL NETWORK SITES WHICH STUDENTS PARTICIPATE IN SOCIAL MEDIA?,2011,
Dialogue and Connectivism A New Approach to Understanding and Promoting DialogueRich Networked Learning,2011,
Digital Divide in Universities Internet Use in Ecuadorian Universities,2011,
Discussing the Geography of Sustainable Development through an International Online Collaboration with Students in Chile and the USA,2011,
Distance Students' Readiness for Social Media and Collaboration,2011,
Domestic and domesticating education in the late Victorian city,2011,
Dynamic and spatial representation of web movements and navigational patterns through the use of navigational paths as data,2011,
Econtent capacity development  RUFORUM network experiences,2011,
EduCamp Colombia Social Networked Learning for Teacher Training,2011,
Education and Recreation Activities of Older Asian Immigrants,2011,
Education as a lifelong process,2011,
Education for Democratic Citizenship in a Digital Culture,2011,
Education for sustainable development and global citizenship An evaluation of the validity of the STAUNCH auditing tool,2011,
Education in motion uses of documentary film in educational research,2011,
Effect of Background Attitudinal and Social Network Variables on PhD Students' Academic Performance. A Multimethod Approach,2011,
Effects of group reflection variations in projectbased learning integrated in a Web 2.0 learning space,2011,
Effects of instructional aids on the acquisition of dynamic decisionmaking skills,2011,
Emergent Learning and Interactive Media Artworks Parameters of Interaction for Novice Groups,2011,
Emergent Learning and Learning Ecologies in Web 2.0,2011,
Emerging education hubs the case of Singapore,2011,
Enhanced virtual microscopy for collaborative education,2011,
Enhancing Parent Leadership Through Building Social and Intellectual Capital,2011,
Enhancing the transition from a Foundation Degree to the third year of an Undergraduate Degree,2011,
Environmental Education Sustainable Agriculture and CGIAR History and Future Prospects,2011,
Environmental learning in online social networks adopting environmentally responsible behaviors,2011,
Epistemic activities and collaborative learning towards an analytical model for studying knowledge construction in networked learning settings,2011,
EVALUATING THE ACCEPTABILITY AND FEASIBILITY OF PROJECT ACCEPT AN INTERVENTION FOR YOUTH NEWLY DIAGNOSED WITH HIV,2011,
Everyday people making a difference on college campuses the tempered grassroots leadership tactics of faculty and staff,2011,
Evolution of a campus sustainability network a case study in organizational change,2011,
Experiences in Personal Lecture Video Capture,2011,
Experiential 'hot' knowledge and its influence on lowSES students' capacities to aspire to higher education,2011,
Exploring affiliation network models as a collaborative filtering mechanism in elearning,2011,
Exploring the experiences and coping strategies of international medical students,2011,
Exploring understandings of inclusion in schools in Zambia and Tanzania using reflective writing and photography,2011,
Facetoface collaborative learning supported by mobile phones,2011,
Facilitating teacher educators' professional learning through a regional research capacitybuilding network,2011,
Factors Affecting Information Seeking and Evaluation in a Distributed Learning Environment,2011,
FEMALE CONDOM SKILL AND ATTITUDE RESULTS FROM A NIDA CLINICAL TRIALS NETWORK GENDERSPECIFIC HIV RISK REDUCTION STUDY,2011,
Feminist thinking on education in Victorian England,2011,
Field birding and digital objects immaterial technologies and their implications for one practice of coming to know the morethanhuman,2011,
Focus Fiddle and Friends Experiences that Transform Knowledge for the Implementation of Innovations,2011,
Frameworks for Understanding the Nature of Interactions Networking and Community in a Social Networking Site for Academic Practice,2011,
Friendship and relationships in virtual and intercultural learning Internationalising the business curriculum,2011,
From EMentoring to Blended Mentoring Increasing Students' Developmental Initiation and Mentors' Satisfaction,2011,
From romance to rocket science speed dating in higher education,2011,
Gay boy talk' meets 'girl talk' HIV risk assessment assumptions in young gay men's sexual health communication with best friends,2011,
Gender barriers in the professional development of women university graduates,2011,
GENDER DIFFERENCES IN USING SOCIAL NETWORKS,2011,
Generating comparing manipulating categorizing reporting and sometimes fabricating data to comply with No Child Left Behind mandates,2011,
Guiding Principles for a Research Schools Network Successes and Challenges,2011,
Hardtoreach? Using health access status as a way to more effectively target segments of the Latino audience,2011,
HELP FROM MY FRIENDS SOCIAL CAPITAL IN THE SOCIAL NETWORK SITES OF LOWINCOME STUDENTS,2011,
Higher Education Policy Networks and Policy Entrepreneurship in Africa The Case of the Association of African Universities,2011,
hivstigma.com an innovative websupported stigma reduction intervention for gay and bisexual men,2011,
Homeless Education and Social Capital An Examination of School and Community Leaders,2011,
Homeless Families' Education Networks An Examination of Access and Mobilization,2011,
Hyperlink network analysis of the educational blog,2011,
Impact of a national programme of professional development in science education,2011,
In Search of a Good College Decisions and Determinations Behind Asian American Students' College Choice,2011,
Inexpensive Options for a HighTech Learning Environment,2011,
Innovating Practicum in Social Education a cooperative work experience,2011,
Innovating Proposals of Work and Collaborative eLearning 2.0 as the Society of Knowledge Requires,2011,
Innovation in VET networks and niggles,2011,
Instructional design for crosscultural online collaboration Grouping strategies and assignment design,2011,
Interaction language learning and social inclusion in early settlement,2011,
Interactive Learning in the Classroom Is Student Response Method Related to Performance?,2011,
Interconnecting Networks of Practice for Professional Learning,2011,
International Approaches to Education a review of some major cooperative programmes,2011,
International Collaboration in Organizations Promoting Geography Education Exploring Success and Acknowledging Limitations,2011,
Internet TechnologyBased Projects in Learning and Teaching English as a Foreign Language at Yakutsk State University,2011,
Interrogating the ethics of literacy intervention in Indigenous schools,2011,
Investigating design and technology students' peer interactions in a technologymediated learning environment A case study,2011,
Investigation of Organizational Interaction and Support in an NGO through ComputerMediated Discussions,2011,
Irony  An Educational Goal?,2011,
Is forcing them worth the effort? Benefits of mandatory internships for graduates from diverse family backgrounds at labour market entry,2011,
Is there a space for critical literacy in the context of social media?,2011,
It sort of feels uncomfortable' problematising the assessment of reflective practice,2011,
Just Add Facilitators and Stir' Stimulating Policy Uptake in Schools,2011,
Language learner selfconcept Complexity continuity and change,2011,
Language learning as a site for belonging a narrative analysis of Korean adopteereturnees,2011,
Language learning motivation self and identity current theoretical perspectives,2011,
Learning as 'Knowing' Towards Retaining and Visualizing Use in Virtual Settings,2011,
Learning from Animated Concept Maps with Concurrent Audio Narration,2011,
Learning Networks Networked Learning,2011,
Learning not to listen the experiences of musicians with hearing impairments,2011,
Learning to teach in a context of education reform liberal studies student teachers' decisionmaking in lesson planning,2011,
Learningservice and Citizenship Education,2011,
LEISURE EXPERIENCES AND DEPRESSIVE SYMPTOMS AMONG CHINESE OLDER PEOPLE A NATIONAL SURVEY IN TAIWAN,2011,
Limbs beyond the skin Exploring the physical realities of digital composition,2011,
Linking Parental Motivations for Involvement and Student Proximal Achievement Outcomes in Homeschooling and Public Schooling Settings,2011,
Longterm study of safe Internet use of young children,2011,
Making the Most of the New Study Abroad Social Capital and the ShortTerm Sojourn,2011,
Many Rhodes travelling scholarships and imperial citizenship in the British academic world 18801940,2011,
Mao Might Cheat The Interactional Construction of the Imaginary Situation in a Fifth Dimension AfterSchool Setting,2011,
Masculinity educational achievement and social status a social network analysis,2011,
Measuring creative potential Using social network analysis to monitor a learners' creative capacity,2011,
Mentor modeling the internalization of modeled professional thinking in an epistemic game,2011,
MENTORING AUSTRALIAN EMERGING RESEARCHERS IN AGING EVALUATION OF A PILOT MENTORING SCHEME,2011,
Mobility and hierarchy in the age of nearuniversal access,2011,
More mentoring needed? A crosssectional study of mentoring programs for medical students in Germany,2011,
More Than Getting Us Through A Case Study in Cultural Capital Enrichment of Underrepresented Minority Undergraduates,2011,
Ms. Trust Gender Networks and TrustImplications for Management and Education,2011,
Multiple peerassessment modes to augment online student questiongeneration processes,2011,
Neoliberalism urbanism and the education economy producing Hyderabad as a 'global city',2011,
Networks of Practice in Science Education Research A Global Context,2011,
Neural Differences in Bilingual Children's Arithmetic Processing Depending on Language of Instruction,2011,
New insights into family learning for refugees bonding bridging and building transcultural capital,2011,
New Literacies A Pedagogical Framework for Reading Virtual Worlds  A Journey into Barbiegirls.com,2011,
One year outcomes of a mentoring scheme for female academics a pilot study at the Institute of Psychiatry King's College London,2011,
OPINIONS OF STUDENTS IN PHYSICAL EDUCATION AND SPORTS TEACHING ON THE USE OF SOCIAL NETWORK SITES,2011,
OPINIONS OF UNIVERSITY GRADUATES ABOUT SOCIAL NETWORKS ACCORDING TO THEIR PERSONAL CHARACTERISTICS,2011,
Participation in civic society in the age group 1332 years olddevelopment influencing factors and context,2011,
Patterns of participation and teaching presence in asynchronous learning networks connecting structural and content analysis,2011,
Pedagogies and Practices in Multilingual Classrooms Singularities in Pluralities,2011,
Physical activity promotion in call centres employers' perspectives,2011,
Postcolonial models cultural transfers and transnational perspectives in Latin America a research agenda,2011,
Power and Networks in Worldwide Knowledge Coordination The Case of Global Science,2011,
Practicum in higher education state of the art,2011,
Predicting ELL students' beginning first grade English oral reading fluency from initial kindergarten vocabulary letter naming and phonological awareness skills,2011,
Preparing Teachers to Design Sequences of Instruction in Earth Systems Science A Comparison of Three Professional Development Programs,2011,
Principals Power and Policy Enacting Supplemental Educational Services,2011,
Print capitalism New School and circulation of reading models. A Brazilian collection at the Primary Education MuseumLibrary in Portugal (19311950),2011,
Professional Boundaries in the Era of the Internet,2011,
Professional communities and student achievement  a metaanalysis,2011,
Promotion of sustainability in postgraduate education in the Asia Pacific region,2011,
Pushing the child centred approach in Myanmar the role of cross national policy networks and the effects in the classroom,2011,
Reading Educational Reform with Actor Network Theory Fluid spaces otherings and ambivalences,2011,
Reading for idea advancement in a Grade 4 knowledge building community,2011,
REASSEMBLING CURRICULAR CONCEPTS A MULTIMODAL APPROACH TO THE STUDY OF CURRICULUM AND INSTRUCTION,2011,
Recommendations for Promoting Elearning in Higher Education Institutions A Case Study of Iran,2011,
Remote from What? Perspectives of Distance Learning Students in Remote Rural Areas of Scotland,2011,
Representing practice practice models patterns bundles ...,2011,
Reproduction of Hierarchy? A Social Network Analysis of the American Law Professoriate,2011,
RESEARCH CAPACITY BUILDING IN EDUCATION THE ROLE OF DIGITAL ARCHIVES,2011,
Revisiting a dreamsite of liberation the case of Mukta Natak in Bangladesh,2011,
Revisiting a dreamsite of liberation the case of Mukta Natak in Bangladesh,2011,
School Friendship of Children and Adolescents in Residential Care,2011,
School Gentrification in the Open Network Society (The Critical Perspective),2011,
School Governing Bodies in England Under Pressure The Effects of Socioeconomic Context and School Performance,2011,
Social networks a learning tool for teams?,2011,
